{
  "schemaVersion": 2,
  "track": "native-android",
  "configurationSource": {"java": "<applicationId path>/meishe/MeisheFeatureConfig.java"},
  "verifiedVersions": ["2.0.1.0"],
  "integrationVerifiedVersions": {
    "2.0.2.1": {
      "status": "verified",
      "evidence": "device-behavior",
      "behavior": "AAR 接入、初始化、拍摄、合拍、编辑和草稿主链路已在 Android 真机通过；该结论不自动证明每个配置字段沿用 2.0.1.0 行为。"
    }
  },
  "fieldMappings": {
    "primaryColor": {
      "zh": "主色",
      "aliases": [
        "主题主色",
        "primary color"
      ]
    },
    "backgroundColor": {
      "zh": "背景色",
      "aliases": [
        "页面背景色",
        "background color"
      ]
    },
    "panelBackgroundColor": {
      "zh": "面板背景色",
      "aliases": [
        "弹窗背景色",
        "panel background color"
      ]
    },
    "textColor": {
      "zh": "主文字颜色",
      "aliases": [
        "文字颜色",
        "text color"
      ]
    },
    "secondaryTextColor": {
      "zh": "次要文字颜色",
      "aliases": [
        "辅助文字颜色",
        "secondary text color"
      ]
    },
    "enableLocalMusic": {
      "zh": "本地音乐入口",
      "aliases": [
        "显示本地音乐",
        "隐藏本地音乐",
        "local music"
      ]
    },
    "shadowOffset": {
      "zh": "文字阴影偏移",
      "aliases": [
        "阴影偏移",
        "shadow offset"
      ]
    },
    "shadowColor": {
      "zh": "文字阴影颜色",
      "aliases": [
        "阴影颜色",
        "shadow color"
      ]
    },
    "albumConfig.type": {
      "zh": "相册素材类型",
      "aliases": [
        "相册类型",
        "素材类型",
        "album type"
      ]
    },
    "albumConfig.maxSelectCount": {
      "zh": "相册最大选择数",
      "aliases": [
        "相册最多选择",
        "album max select count"
      ]
    },
    "albumConfig.useAutoCut": {
      "zh": "相册一键成片",
      "aliases": [
        "一键成片",
        "相册 AutoCut",
        "album autocut"
      ]
    },
    "templateConfig.maxSelectCount": {
      "zh": "模板最大选择数",
      "aliases": [
        "模板最多选择",
        "template max select count"
      ]
    },
    "templateConfig.useAutoCut": {
      "zh": "模板一键成片",
      "aliases": [
        "一键成片",
        "模板 AutoCut",
        "template autocut"
      ]
    },
    "templateConfig.maxRecommandTemplateCount": {
      "zh": "推荐模板最大数量",
      "aliases": [
        "推荐模板数量",
        "max recommended template count"
      ]
    },
    "captureConfig.captureDeviceIndex": {
      "zh": "默认摄像头",
      "aliases": [
        "前后摄像头",
        "capture device index"
      ]
    },
    "captureConfig.resolution": {
      "zh": "拍摄预览分辨率",
      "aliases": [
        "拍摄分辨率",
        "capture resolution"
      ]
    },
    "captureConfig.fps": {
      "zh": "拍摄帧率",
      "aliases": [
        "录制帧率",
        "capture fps"
      ]
    },
    "captureConfig.imageDuration": {
      "zh": "拍摄图片时长",
      "aliases": [
        "照片时长",
        "capture image duration"
      ]
    },
    "captureConfig.autoSavePhotograph": {
      "zh": "拍照自动保存相册",
      "aliases": [
        "拍照保存相册",
        "auto save photograph"
      ]
    },
    "captureConfig.timeRanges": {
      "zh": "普通录制时长档位",
      "aliases": [
        "录制时长",
        "capture time ranges"
      ]
    },
    "captureConfig.smartTimeRange": {
      "zh": "快拍时长范围",
      "aliases": [
        "快拍时长",
        "smart capture time range"
      ]
    },
    "captureConfig.filterDefaultValue": {
      "zh": "拍摄滤镜默认强度",
      "aliases": [
        "拍摄滤镜强度",
        "capture filter default value"
      ]
    },
    "captureConfig.enableCaptureAlbum": {
      "zh": "拍摄页相册入口",
      "aliases": [
        "拍摄相册",
        "enable capture album"
      ]
    },
    "captureConfig.ignoreVideoRotation": {
      "zh": "忽略视频旋转",
      "aliases": [
        "视频旋转方向",
        "ignore video rotation"
      ]
    },
    "captureConfig.autoDisablesMic": {
      "zh": "拍摄自动静音",
      "aliases": [
        "拍摄自动关闭麦克风",
        "capture auto disable mic"
      ]
    },
    "captureConfig.recordConfiguration": {
      "zh": "底层录制配置",
      "aliases": [
        "拍摄编码配置",
        "record configuration"
      ]
    },
    "beautyConfig.categoricalArray": {
      "zh": "美颜分类",
      "aliases": [
        "美颜分类列表",
        "beauty categories"
      ]
    },
    "beautyConfig.beautyEffectArray": {
      "zh": "美肤列表",
      "aliases": [
        "美肤项目",
        "beauty effect list"
      ]
    },
    "beautyConfig.beautyShapeArray": {
      "zh": "美型列表",
      "aliases": [
        "美型项目",
        "beauty shape list"
      ]
    },
    "beautyConfig.beautyMicroShapeArray": {
      "zh": "微整形列表",
      "aliases": [
        "微整形项目",
        "beauty micro shape list"
      ]
    },
    "beautyConfig.beautyAdjustArray": {
      "zh": "美颜调节列表",
      "aliases": [
        "调节列表",
        "beauty adjust list"
      ]
    },
    "dualConfig.left": {
      "zh": "合拍窗口左边距",
      "aliases": [
        "合拍窗口横向位置",
        "dual left"
      ]
    },
    "dualConfig.top": {
      "zh": "合拍窗口上边距",
      "aliases": [
        "合拍窗口纵向位置",
        "dual top"
      ]
    },
    "dualConfig.limitWidth": {
      "zh": "合拍窗口大小",
      "aliases": [
        "合拍窗口宽度",
        "dual limit width"
      ]
    },
    "dualConfig.defaultType": {
      "zh": "合拍默认版式",
      "aliases": [
        "默认合拍样式",
        "dual default type"
      ]
    },
    "dualConfig.supportedTypes": {
      "zh": "合拍支持版式",
      "aliases": [
        "合拍样式列表",
        "dual supported types"
      ]
    },
    "dualConfig.autoDisablesMic": {
      "zh": "合拍自动静音",
      "aliases": [
        "合拍自动关闭麦克风",
        "dual auto disable mic"
      ]
    },
    "editConfig.editMenuItems": {
      "zh": "编辑功能菜单",
      "aliases": [
        "编辑菜单",
        "edit menu items"
      ]
    },
    "editConfig.resolution": {
      "zh": "编辑预览分辨率",
      "aliases": [
        "编辑分辨率",
        "edit preview resolution"
      ]
    },
    "editConfig.fps": {
      "zh": "编辑预览帧率",
      "aliases": [
        "编辑帧率",
        "edit preview fps"
      ]
    },
    "editConfig.minEffectDuration": {
      "zh": "最短特效时长",
      "aliases": [
        "特效最小时长",
        "minimum effect duration"
      ]
    },
    "editConfig.minAudioDuration": {
      "zh": "最短录音时长",
      "aliases": [
        "最短配音时长",
        "minimum audio duration"
      ]
    },
    "editConfig.defaultImageDuration": {
      "zh": "编辑图片默认时长",
      "aliases": [
        "图片默认时长",
        "default image duration"
      ]
    },
    "editConfig.captionColor": {
      "zh": "默认字幕颜色",
      "aliases": [
        "字幕颜色",
        "caption color"
      ]
    },
    "editConfig.captionColorList": {
      "zh": "字幕颜色列表",
      "aliases": [
        "可选字幕颜色",
        "caption color list"
      ]
    },
    "editConfig.supportedCaptionStyles": {
      "zh": "支持的字幕样式",
      "aliases": [
        "字幕样式",
        "supported caption styles"
      ]
    },
    "editConfig.bubbleConfig": {
      "zh": "字幕气泡配置",
      "aliases": [
        "气泡样式",
        "bubble config"
      ]
    },
    "editConfig.editModeSource": {
      "zh": "画幅来源",
      "aliases": [
        "编辑画幅来源",
        "edit mode source"
      ]
    },
    "editConfig.editMode": {
      "zh": "初始编辑画幅",
      "aliases": [
        "固定画幅",
        "edit mode"
      ]
    },
    "editConfig.supportedEditModes": {
      "zh": "支持的编辑画幅",
      "aliases": [
        "支持画幅",
        "supported edit modes"
      ]
    },
    "editConfig.maxVolume": {
      "zh": "最大音量",
      "aliases": [
        "编辑最大音量",
        "max volume"
      ]
    },
    "editConfig.filterDefaultValue": {
      "zh": "编辑滤镜默认强度",
      "aliases": [
        "编辑滤镜强度",
        "edit filter default value"
      ]
    },
    "editConfig.disableTimeEffect": {
      "zh": "禁用时间特效",
      "aliases": [
        "关闭时间特效",
        "disable time effect"
      ]
    },
    "compileConfig.resolution": {
      "zh": "导出分辨率",
      "aliases": [
        "合成分辨率",
        "compile resolution"
      ]
    },
    "compileConfig.fps": {
      "zh": "导出帧率",
      "aliases": [
        "合成帧率",
        "compile fps"
      ]
    },
    "compileConfig.bitrateGrade": {
      "zh": "导出码率等级",
      "aliases": [
        "码率等级",
        "bitrate grade"
      ]
    },
    "compileConfig.bitrate": {
      "zh": "导出精确码率",
      "aliases": [
        "导出码率",
        "compile bitrate"
      ]
    },
    "compileConfig.imageType": {
      "zh": "封面图片格式",
      "aliases": [
        "封面格式",
        "cover image type"
      ]
    },
    "compileConfig.autoSaveVideo": {
      "zh": "导出后自动保存视频",
      "aliases": [
        "自动保存视频",
        "auto save video"
      ]
    },
    "compileConfig.watermarkConfig": {
      "zh": "视频水印",
      "aliases": [
        "导出水印",
        "video watermark"
      ]
    },
    "compileConfig.coverWatermarkConfig": {
      "zh": "封面水印",
      "aliases": [
        "封面图片水印",
        "cover watermark"
      ]
    },
    "compileConfig.configure": {
      "zh": "底层合成配置",
      "aliases": [
        "合成字典",
        "compile configuration"
      ]
    },
    "modelConfig.*": {
      "zh": "模型文件配置",
      "aliases": [
        "模型路径",
        "model configuration"
      ]
    },
    "captureMenuItems": {
      "zh": "拍摄右侧菜单",
      "aliases": [
        "普通拍摄菜单",
        "拍摄功能菜单",
        "capture menu items"
      ]
    },
    "captureBottomMenuItems": {
      "zh": "拍摄底部模式",
      "aliases": [
        "拍摄底部菜单",
        "capture bottom menu items"
      ]
    },
    "defaultBottomMenuSelectItem": {
      "zh": "默认拍摄模式",
      "aliases": [
        "默认底部模式",
        "default capture mode"
      ]
    },
    "dualMenuItems": {
      "zh": "合拍右侧菜单",
      "aliases": [
        "合拍功能菜单",
        "dual capture menu items"
      ]
    }
  },
  "valueMappings": {
    "captureMenuItems::device": {
      "zh": "翻转摄像头",
      "aliases": [
        "切换摄像头",
        "前后摄像头切换"
      ]
    },
    "captureMenuItems::speed": {
      "zh": "快慢速",
      "aliases": [
        "拍摄快慢速",
        "普通拍摄快慢速",
        "拍摄速度"
      ]
    },
    "captureMenuItems::timer": {
      "zh": "倒计时",
      "aliases": [
        "拍摄倒计时",